{
  "schema_version": "2.0.0",
  "data_version": "0.1.0-draft",
  "battle_id": "battle-p1",
  "program_id": "AIP-0001",
  "program_version": 1,
  "actor_id": "actor-1",
  "seed": 12345,
  "events": [
    {
      "tick": 0,
      "phase": "reservation",
      "step": 1,
      "instruction_id": "I-0001",
      "origin_part_id": "node-search",
      "source_node_id": "node-search",
      "event_type": "search",
      "result": "found",
      "details": {"candidate_ids": ["enemy-1"]}
    },
    {
      "tick": 0,
      "phase": "reservation",
      "step": 2,
      "instruction_id": "I-0002",
      "origin_part_id": "edge-call",
      "source_node_id": "node-search",
      "event_type": "call",
      "result": "entered",
      "details": {"subroutine_id": "SUB-1", "call_depth": 1, "return_instruction_id": "I-0004"}
    }
  ],
  "outcome": {"status": "selected", "action_id": "AIA-0002", "target_id": "enemy-1", "reason": null}
}
